"","screen_name","name","location","description","followers_count","friends_count","listed_count","statuses_count","favourites_count","account_created_at","verified","profile_expanded_url","outlet"
"1","TechCrunch","TechCrunch","San Francisco, CA","Breaking technology news, analysis, and opinions from TechCrunch. Got a tip? tips@techcrunch.com",10112211,959,108102,213710,5753,2007-03-07 01:27:09,TRUE,"http://techcrunch.com/subscribe","TechCrunch"
"2","TCEurope","TechCrunch Euro News","Europe","Breaking technology news, analysis, and opinions. European news from TechCrunch. Main writers: @mikebutcher, @IngridLunden, @riptari, @romaindillet & @sohear.",62039,58,3135,10451,8,2007-09-09 08:31:23,FALSE,"http://techcrunch.com/europe","TechCrunch"
"3","TCFR","TechCrunch France","France","Breaking technology news and opinions on the French tech ecosystem by @TechCrunch’s European team: @romaindillet, @sohear, @mikebutcher, @riptari, @ingridlunden",38498,225,1833,5241,1,2007-06-28 06:10:44,TRUE,"http://techcrunch.com","TechCrunch"
"4","tcmoscow","TechCrunch Moscow","Moscow, Russia ","TechCrunch Moscow - the only TC event in Russia,  bringing over top-level speakers to discuss tech startups, global trends, and VC in Russia. #tcmoscow",1967,336,74,793,10,2010-11-25 00:10:14,FALSE,"http://tc.digitaloctober.com","TechCrunch"
"5","kylebrussell","Kyle Russell","","Always learning — Now: Founder/CEO @PlaybyteInc — Previously: @SkydioHQ @a16z @TechCrunch",20552,1675,867,38700,211141,2009-06-30 00:43:19,TRUE,"http://kylerussell.today","TechCrunch"
"6","alex","alex","Providence (sometimes SF)","Journalist with @TechCrunch. I write The Exchange, and co-host Equity. @lizaswagner's partner. alex.wilhelm@techcrunch.com. You rock!",72499,2115,3500,59971,136729,2007-07-10 18:47:05,TRUE,"http://alexwilhelm.com","TechCrunch"
"7","mikebutcher","Mike Butcher","London","(MBE, FRSA) Editor-at-large @TechCrunch mike@techcrunch.com Insta: mikebutcher",143933,14273,5054,84171,37613,2006-11-21 21:59:13,TRUE,"https://mikebutcher.me/newsletter","TechCrunch"
"8","kimmaicutler","Kim-Mai Cutler","San Francisco","Partner at @initialized. Previously @techcrunch. When life hands me lemons, I make tarte au citron.",52974,17000,1864,60213,139629,2008-04-12 07:52:27,TRUE,"https://medium.com/initialized-capital","TechCrunch"
"9","lucasmtny","Lucas Matney","SF","reporter @techcrunch  // lucas at techcrunch dot com",11287,977,378,803,9386,2011-08-18 22:18:04,TRUE,"https://vote.gov","TechCrunch"
"10","arrington","Michael Arrington","Seattle, WA","Founder of TechCrunch, CrunchBase and Arrington XRP Capital. Be Excellent To Each Other.",241524,3282,9334,18661,35726,2009-05-04 02:20:17,TRUE,"http://www.arringtonxrpcapital.com","TechCrunch"
"11","TechCrunchOnion","TechCrunch Onion","","Silicon Valley's Finest News Source.",14182,2,467,59,5699,2013-03-12 16:58:06,FALSE,NA,"TechCrunch"
"12","jasonkincaid","Jason Kincaid","San Francisco / madame george on repeat","author, musician, self-loathing marketer. slinging 👕 on https://t.co/NHjYdVAW8u  ~ places derped: TechCrunch / VCs & startups / non-profits / HBO / 🧙‍♂️🎸",26215,3208,1516,3998,2871,2008-04-11 19:59:23,TRUE,"http://jasonkincaid.net","TechCrunch"
"13","zackwhittaker","Zack Whittaker","New York, NY","Security Editor, @TechCrunch
Signal: +1.646.755.8849
Email: zack.whittaker@techcrunch.com or
zack.whittaker@protonmail.com",57967,999,1669,1138,61354,2008-08-06 17:00:05,TRUE,"http://this.weekinsecurity.com","TechCrunch"
"14","sarahintampa","Sarah Perez","Raleigh, N.C.","Reporter at @TechCrunch. This is my email: sarahp@techcrunch.com. I used to be in Tampa. Now I'm in Raleigh. I didn't think this Twitter username thing through.",61792,9623,2839,31989,10675,2007-01-22 23:06:17,TRUE,"http://techcrunch.com/author/sarah-perez/","TechCrunch"
"15","erickschonfeld","Erick Schonfeld","New York","Now: Traction Technology, TouchCast; Previous: TechCrunch, Business 2.0, Fortune",72995,1370,3194,27728,1923,2008-01-28 20:10:24,TRUE,"https://www.tractiontechnology.com/","TechCrunch"
"16","JoshConstine","Josh Constine -SignalFire","Mission SF, CA","@SignalFire Principal & Head Of Content. Ex-editor at @TechCrunch. Now I write this newsletter. I put care into it: https://t.co/zhljWDJFoa",77644,2460,2566,36932,53159,2009-01-26 22:41:23,TRUE,"https://www.signalfire.com/","TechCrunch"
"17","anthonyha","Anthony Ha","New York, NY","Writer for @TechCrunch. Send tips and pitches to anthonyha@techcrunch.com (DM for Signal). He/him",43214,728,1806,20222,15348,2008-03-31 20:18:17,TRUE,"http://www.anthony-ha.com","TechCrunch"
"18","sohear","Steve O'Hear","London, England","Non-award winning journalist @TechCrunch covering European startups. Recovering founder. I learn from my mistakes so I can repeat them all perfectly. #COYS",24991,1843,1092,44372,11403,2007-04-08 15:55:04,TRUE,"http://ohear.net","TechCrunch"
"19","Cookie","Connie Loizos","San Francisco","silicon valley editor @techcrunch, founder @strictlyvc, cohost of ""strictlyvc download"" podcast, panini press enthusiast always. tips to connie@strictlyvc.com",14328,918,565,3139,3160,2006-09-27 23:21:48,TRUE,"http://www.strictlyvc.com","TechCrunch"
"20","HoldenthePage","Holden+ Page","Minneapolis, MN","Chaotic anxiety. Seen on @mixpanel @techcrunch @crunchbasenews @mattermark. Contact: holdenpage@gmail.com",3053,666,155,181,22198,2008-03-12 11:42:28,TRUE,NA,"TechCrunch"
"21","robinwauters","Robin Wauters @ Tech.eu","Mostly Brussels; often on a ✈","European tech journalist and analyst; founder of @tech_eu, previously @TheNextWeb & @TechCrunch. Also proud co-founder of @StartupLensEU and @BeCentralBxl.",53777,18224,3831,103118,26406,2007-01-10 13:29:18,TRUE,"http://tech.eu","TechCrunch"
"22","mjburnsy","Matt Burns","Flint, MI","Lover of gadgets. Occasional woodworker. TechCrunch Managing Editor. And I live in Michigan. That's about it.",16888,1146,693,6577,1519,2008-11-07 00:34:34,TRUE,NA,"TechCrunch"
"23","danielbru","Daniel Brusilovsky","San Francisco, CA","Digital & Technology at @Warriors. Co-Founder of @imoji. Founded @TeensinTech. Previously at @Ribbon, @HighlandCapital, @TechCrunch, and Qik.",452721,23084,3084,13620,287552,2007-03-25 01:44:56,TRUE,"http://www.danielbru.com","TechCrunch"
"24","jordanrcrook","Jordan Crook","Brooklyn, NY","Managing Editor @TechCrunch Socializing since 1988.",25344,1284,922,14707,11179,2011-05-10 15:57:48,TRUE,"https://open.spotify.com/user/1223710165","TechCrunch"
"25","meganrosedickey","mrd","San Francisco","Senior reporter @TechCrunch Pronouns: she/her/hers megan@techcrunch.com",14484,557,658,633,5416,2009-04-02 18:09:21,TRUE,NA,"TechCrunch"
"26","romaindillet","Romain Dillet 🙃","Paris","Writing about tomorrow, looking for the perfect emoji today.
Senior Writer at @TechCrunch.",16101,646,635,7950,1652,2008-01-17 21:01:08,TRUE,"https://techcrunch.com","TechCrunch"
"27","ganglu","Gang Lu","Shanghai, China","Founder of @technodechina, the leading bilingual tech media in China, also manages TechCrunch China @techcrunchcn #ChinaTech",13271,1222,400,6865,1228,2007-06-01 01:01:25,TRUE,"http://www.technode.com","TechCrunch"
"28","gregmepstein","Greg Epstein","Oran, French Algeria-the 1940s","Humanist Chaplain @Harvard/@MIT. NYTimes bestseller @GoodWithoutGod. Ethics📝 @TechCrunch @bostonglobe etc. Developing #stayinghuman podcast @MIT @MindHandHeart",18359,3790,302,7638,14247,2009-06-23 23:35:03,TRUE,"https://twitter.com/TechCrunch/status/1271841562855706624","TechCrunch"
"29","etherington","Darrell Etherington","Toronto, ON","TechCrunch (yes again) Science Editor. darrell@techcrunch.com, or on Signal at 1-415-670-9698",23928,863,1002,13011,5175,2008-07-14 10:52:53,TRUE,NA,"TechCrunch"
"30","eldon","Eric Rosser Eldon","Bay Area","Managing Editor, Extra Crunch /@techcrunch",20417,1213,924,10995,7637,2007-08-06 02:18:49,TRUE,"http://about.me/eric.eldon","TechCrunch"
"31","ViperChill","Glen Allsopp (Not here for a while)","Hong Kong","Founder of https://t.co/TucJ8WR8dq and https://t.co/5a1dJYyy0k. I do SEO mostly. Have written for TechCrunch and mentioned on the BBC, Guardian, Forbes and more (I have no idea how)",28062,310,1479,2990,10918,2008-01-21 21:29:09,TRUE,"https://detailed.com","TechCrunch"
"32","HilzFuld","Hillel Fuld","Israel","Global Speaker; Tech Vlogger; Columnist: TechCrunch/Venturebeat/JPost/Inc; Marketing Mentor: Google/MSFT/Oracle/Huawei; Startup Advisor; Family Man; Carnivore.",37470,932,2174,187701,15798,2008-08-21 11:21:02,TRUE,"http://HillelFuld.com","TechCrunch"
"33","tayhatmaker","Taylor Hatmaker","pdx","housecat fan account. reporter: politics, platforms, etc @techcrunch. photographer. past: editor @thedailybeast. 🌈 tips: DM for Signal",10075,896,495,6439,27981,2008-06-02 18:51:43,TRUE,NA,"TechCrunch"
"34","kirstenkorosec","Kirsten Korosec","","Senior reporter @techcrunch. I write about the future of transportation. Wearer of helmets, backcountry wanderer. DM me tips.  Co-host of @TheAutonocast",8039,657,400,6506,2987,2009-02-03 22:30:08,TRUE,"http://www.techcrunch.com","TechCrunch"
"35","DannyCrichton","Danny Crichton","Manhattan, NY","Managing Editor @TechCrunch, analyzing next-gen silicon and compute, cloud, data science, and more. Big ideas: danny@techcrunch.com",7055,378,287,3316,8670,2010-03-01 06:43:23,TRUE,"https://www.dannycrichton.com/","TechCrunch"
"36","dicebourbon","Bryce Durbin","Decorah, IA","Illustrator/designer for @TechCrunch, FOT, midwesterner.",1328,643,67,12400,66610,2007-06-25 15:40:25,TRUE,"http://brycedurbin.com","TechCrunch"
"37","mattlynley","Matthew Lynley","San Francisco, CA","Telling stories with data. Former PMM @brexHQ, writer @TechCrunch, @WSJ, @BuzzFeed. Math @UNC 2010. DMs open for: Signal, PGP, poorly-timed GIFs.",15470,893,752,39903,6414,2008-02-06 06:55:03,TRUE,NA,"TechCrunch"
"38","CatherineShu","Catherine Shu 🧶","Taipei City, Taiwan","Taiwanese-American writer for @TechCrunch. Monitors new tech developments, loves old tech like spinning wheels and handlooms. she/her shu@techcrunch.com",12377,1281,510,11858,17818,2007-07-11 02:13:33,TRUE,"https://www.linkedin.com/in/catherineshu","TechCrunch"
"39","ron_miller","Ron Miller","","TechCrunch enterprise reporter, Boston sports fanatic. ron@techcrunch.com.",18977,2139,1063,71059,7599,2007-05-08 19:44:50,TRUE,"https://techcrunch.com/author/ron-miller/","TechCrunch"
"40","jmauldn","Justin Mauldin","Austin, TX","ceo salient pr, @businessinsider top 50 in tech PR, contrib @gettyimages @techcrunch, crypto over fiat, lifetime chess player, dachshund wrangler, new daddy-o",16428,1189,365,12276,149513,2009-06-03 07:08:58,TRUE,"http://salientpr.com","TechCrunch"
"41","Grg","Greg Kumparak","Oakland, CA","editor at techcrunch.",17272,655,979,599,2730,2008-03-03 20:47:33,TRUE,"http://www.techcrunch.com","TechCrunch"
"42","nmasc_","natasha mascarenhas","pls don't pitch me on linkedin","startup and tech journalist for @techcrunch 💸 i podcast on fridays @equitypod and i blog on mondays at https://t.co/44Npsqi54A. 

she/her",10983,3289,176,8479,9316,2015-11-13 17:38:02,TRUE,"https://natasha.substack.com/","TechCrunch"
"43","verizonmedia","Verizon Media","Sunnyvale, CA","We're creating what's next in content, advertising, and technology with our brands Yahoo, HuffPost, TechCrunch and more. #verizonmedia",14452,611,178,3576,3126,2017-04-04 21:12:59,TRUE,"https://www.verizonmedia.com/","TechCrunch"
"44","ExtraCrunch","Extra Crunch","San Francisco, CA","Premium membership from @TechCrunch. We’re democratizing information about startups.",1323,36,43,1226,241,2019-09-17 21:52:08,TRUE,"http://techcrunch.com/subscribe","TechCrunch"
"45","epeckham","Eric Peckham","Los Angeles, CA","TechCrunch columnist + writer of the Monetizing Media newsletter // Focused on the future of (interactive) media, communications, & learning.",2528,535,78,143,217,2009-05-13 13:52:10,FALSE,"http://monetizingmedia.com","TechCrunch"
"46","popo","Steve Poland","Buffalo, NY","Entrepreneur. Former @TechCrunch @Z80Labs. Data, APIs. Epicurean. Co-founder of two beautiful girls #buffalove #foodie #concerts #sabres #billsmafia #boilerup",5050,1854,253,22325,27660,2007-03-26 03:41:07,FALSE,"http://stevepoland.com/about","TechCrunch"
"47","fitztepper","Fitz Tepper","New York, NY","@onrallyrd ex @techcrunch. trustee @haverfordschool. ex @usc @fordhamlawNYC",5432,858,180,2129,6829,2008-01-15 03:41:27,TRUE,NA,"TechCrunch"
"48","RaeWitte","rae","Brooklyn","i'm in bed / words @ilymag @i_D @WSJ @techcrunch @forbes @fashionista_com @voguebusiness and others",8525,1020,109,82314,113180,2009-03-18 00:51:00,TRUE,"http://sheknewwhatshewasdoing.com","TechCrunch"
"49","getdonovan","Jay Donovan","Columbus, OH","Cofounder of Visible Magic, @TechCrunch alum, MBA from @capital_u. Bass @theVillaintinos. Gadget junkie.",3485,1069,215,5294,389,2007-11-20 03:52:37,TRUE,"https://techcrunch.com/author/jay-donovan/","TechCrunch"
"50","refsrc","Manish Singh","India","India @TechCrunch.",4206,675,124,2683,11261,2012-10-11 17:44:44,TRUE,NA,"TechCrunch"
"51","neddesmond","Ned Desmond","Bay Area","Always learning. TechCrunch.",2148,685,90,6686,1277,2008-05-28 02:37:51,TRUE,NA,"TechCrunch"
"52","EquityPod","Equity Podcast","","Equity is TechCrunch’s venture capital podcast. In each episode, we bring you the numbers behind the headlines.
https://t.co/wvgGiDAGCq
https://t.co/lZpui6qvNe",516,5,3,15,12,2017-12-14 18:27:53,FALSE,NA,"TechCrunch"
"53","ritacyliao","Rita Liao","Shenzhen or somewhere smoggy","Covering China tech for @TechCrunch | Formerly @SOSV @BowdoinCollege | ritaliao@pm.me",1625,386,52,685,1013,2017-07-27 06:30:38,TRUE,"https://techcrunch.com/author/rita-liao/","TechCrunch"
"54","Pickavet","Henry Pickavet","Oakland, California","Editorial Director @TechCrunch. @athletics fan. @spurs fan. Cricket fan. Writing a memoir. Your favorite Leo. Trans. He/him 🏳️‍🌈",3037,1348,142,4331,2297,2008-05-20 01:38:06,TRUE,"https://writinghumbuggery.wordpress.com/","TechCrunch"
"55","JakeRBright","Jake Bright","New York, NY (Michigan Native)","Writer/Author/Adviser on Global Biz, Pol & Tech| Team @TechCrunch| Wrider @Revzilla| @TNAfricabook| ♡ Outdoor Sports| FollowersReal",4589,699,105,7619,4555,2012-08-21 01:46:25,FALSE,"http://www.jakebright.com","TechCrunch"
"56","travisbernard","Travis Bernard","Marina del Rey, CA","Senior Director of Membership @TechCrunch | Building @ExtraCrunch",4551,1178,232,16858,15993,2009-08-13 20:10:19,TRUE,"http://www.techcrunch.com/subscribe","TechCrunch"
"57","ajdomanico","Anthony Domanico","Nowhere","Financial consultant in the healthcare industry. Former freelance writer with CNET, Techcrunch Events, Laptop Magazine, and others.",4431,882,239,2580,15139,2009-02-28 16:42:51,TRUE,NA,"TechCrunch"
"58","annaescher","anna","San Francisco, CA","Head of audience at @DFINITY. Ex @techcrunch. She/her. You rock!",7009,837,104,2159,3177,2011-05-13 02:37:07,TRUE,"https://anna-escher.squarespace.com","TechCrunch"
"59","pankajontech","pankaj mishra","Bangalore","Malang, journalist, cofounder @Factordaily host Outliers podcast. Humanising tech, one story at a time.Past @EconomicTimes @TechCrunch @livemint",13295,1,348,21107,16756,2012-02-20 05:10:43,FALSE,"http://www.factordaily.com","TechCrunch"
"60","steven_aquino","Steven Aquino","San Francisco, CA","Disabled person and AX expert. Freelance tech reporter covering accessibility and assistive tech. Bylines at @Forbes @TechCrunch @iMore and elsewhere.",3878,1028,234,51146,6090,2010-06-05 03:30:39,TRUE,"https://www.stevenaquino.co","TechCrunch"
"61","meharris","Mark Harris","Seattle","Tech investigations for IEEE Spectrum, The Guardian, Wired, MIT TR, Ars, TechCrunch, New Scientist. 2014 KSJ. 2015 Kavli. He/His. BLM. mark(at)meharris(dot)com",5578,899,285,7665,6889,2009-01-26 19:21:15,TRUE,"http://www.meharris.com","TechCrunch"
"62","Bartozone","Greg","Austin, TX","Started in Hollywood. @techcrunch survivor. Currently @occipital, and living in Texas.",2422,1092,77,3836,9860,2009-09-11 21:01:48,TRUE,NA,"TechCrunch"
"63","niclauren","Nicole Wilke","San Francisco","Product/UX @charmingrobot. Formerly of @TechCrunch, @Wired & @Disney. Raised on Kauai and Geocities.",1842,355,76,1952,533,2008-04-29 19:03:43,FALSE,NA,"TechCrunch"
"64","helloyashad","Yashad","San Francisco, CA","Executive Producer of Video @techcrunch",1304,2159,48,1620,1941,2010-03-17 07:46:57,TRUE,"http://www.yashad.com","TechCrunch"
"65","jeffryta","Jeff Taylor","Oakland, Ca","TechCrunch Event Sales, People, Zen, Tech, relationships...the mixture of emptiness.  Super fun, really real, and avocados",476,594,15,2011,1005,2012-07-12 22:00:03,FALSE,NA,"TechCrunch"
"66","BrooksRainwater","Brooks Rainwater","Washington, DC","Dad, Husband, Senior Executive + Director, Center for City Solutions @LeagueofCities | Writer @FastCompany @CityLab @Techcrunch + others | Views my own",4215,983,452,21335,19302,2009-01-17 02:46:13,TRUE,"http://www.nlc.org/program-initiative/center-for-city-solutions","TechCrunch"
"67","JohnMannes","John Mannes","San Francisco, CA","VC @BasisSet, Words @TechCrunch, CogSci @Umich, Former Board Member @mocoboe, Pitch via email: john@basisset.ventures",3644,908,171,1878,1562,2011-12-26 00:55:54,TRUE,"http://basisset.ventures","TechCrunch"
"68","kteare","Keith Teare","Palo Alto, CA","US Managing Partner at Accelerated Digital Ventures (https://t.co/Sl1SBdTa7t) & https://t.co/Byn3OYhUJq. Previously founding investor at TechCrunch.EasyNet",5986,2088,222,6304,3129,2007-05-04 05:40:12,FALSE,"http://www.teare.com","TechCrunch"
"69","MaxTB","Max Tatton-Brown","","Good ideas, bad ideas & question marks. Bylined @qz @techcrunch @siftedEU. Run Augur Comms for ""unsexy"" tech scaleups.",4903,956,324,2331,6583,2008-10-01 11:05:56,FALSE,"http://augur.co.uk","TechCrunch"
"70","christinekmagee","Christine Magee","New York, NY","Marketing @AlphaSenseInc. ex-@Andela, @CrunchBase & @TechCrunch.",2589,1260,75,1089,1599,2011-06-26 07:44:26,TRUE,NA,"TechCrunch"
"71","CathyReisenwitz","Cathy Reisenwitz 🏗🌐🥑","San Francisco, CA","Founder/CEO, Sex and the State. Land-use & sex+ feminism. Bylines in TechCrunch, the Daily Beast, The Week, Reason, etc. Newsletter: https://t.co/isVhNwDAMN",11573,4143,436,44896,73729,2010-08-22 22:20:07,TRUE,"https://www.cathyreisenwitz.com/","TechCrunch"
"72","titoyooo","Tito Hamze","San Francisco, CA","Owner @sunolgroupmedia and @thegiraffespace. :) Former @techcrunch. Love cake",5821,459,138,1626,1302,2013-09-11 06:04:00,TRUE,"https://www.youtube.com/user/titoyo","TechCrunch"
"73","YourProtagonist","Walter Thompson","San Francisco","Senior Editor, Extra Crunch/@TechCrunch, Writer, @GoldenCityPod. Formerly City Editor, @hoodline",1800,1327,91,31278,13369,2008-06-17 20:31:19,TRUE,"http://anchor.fm/thegoldencity","TechCrunch"
"74","JumboPrivacy","Jumbo: Privacy + Security","AppStore, GooglePlay","Jumbo is an app that gives you back control of your data and privacy. Featured by the New York Times, The Verge, Fast Company, TechCrunch. Download for free.",11674,449,67,1085,625,2019-01-24 18:37:56,TRUE,"https://download.jumboprivacy.com/?campaign=twitter-website","TechCrunch"
"75","SteinSamantha","Samantha Stein","Silicon Valley","Artist @ Wombkind | Love fearlessly | Former Startup Battlefield Editor @TechCrunch | Former Curator @WEF Global Shapers | Founder @Hacktivision",1520,1826,55,409,384,2012-09-07 21:59:57,FALSE,"https://www.wombkind.com","TechCrunch"
"76","VerizonMedia_UK","Verizon Media UK","London","We're creating what's next in content, advertising, and technology with our brands Yahoo, HuffPost, TechCrunch and more. #verizonmedia",5236,3644,91,4962,3305,2010-12-21 13:48:24,TRUE,"http://verizonmedia.com","TechCrunch"
"77","BosBizLucy","Lucia ""Lucy"" Maffei","Boston, MA","Seed: @MedillSchool. Series A: @techcrunch. Series B: @BostInno. Now running in the big league at @BosBizJournal. Oh, I cover tech: lmaffei@bizjournals.com",7026,1658,451,10761,2571,2013-10-16 01:37:14,FALSE,"https://www.bizjournals.com/boston/bio/40681/Lucia+Maffei","TechCrunch"
"78","kmurph415","Kim Murphy","San Francisco ","chic geek, lover of impromptu dance parties, kim-possible. formerly at Engadget & TechCrunch. did Money & Life @ CreativeLive. now Alexa edu @ Amazon",444,880,15,530,631,2013-01-07 23:44:47,FALSE,"http://www.linkedin.com/in/kimberlyannmurphy","TechCrunch"
"79","nitishpkulkarni","Nitish Kulkarni","San Francisco, CA","Formerly @Palantir_FR, @Apple, @TechCrunch, @DARPA, and @StanfordDaily. I don’t represent my (or any) employer on Twitter.",1071,867,18,1859,4038,2015-08-06 16:02:13,TRUE,NA,"TechCrunch"
"80","arimeisel","Ari Meisel","New York, NY","Entrepreneur/Founder @lessdoing | Author ""The Replaceable Founder"" | Speaker @TEDx | Contributor @TIME @TechCrunch | Kirkland Signature Aficionado @costco",11702,8835,469,17980,416,2008-10-28 14:15:51,TRUE,"http://www.lessdoing.com","TechCrunch"
"81","vitalyg","Vitaly M. Golomb 🚀","San Francisco or in the clouds","Managing Partner @GSCapCo / Speaker / @TechCrunch Contributor / Author of Accelerated Startup / checkout my new podcast: https://t.co/Y8Os7IJUzO // Tweets are my own",6121,1378,275,8599,1778,2008-02-16 22:20:37,FALSE,"http://golomb.net","TechCrunch"
"82","ConradEgusa","Conrad Egusa","New York, NY","CEO at Publicize (https://t.co/Yv0zNxnYOl) & ESPACIO (https://t.co/XGmjniFbZP), 500 Startups Global Mentor, TechCrunch Guest Contributor",11435,5076,213,6724,12261,2009-01-29 06:13:34,TRUE,"http://www.linkedin.com/in/conradegusa","TechCrunch"
"83","shloky","Shlok Vaidya","Austin, TX","Writer, private equity, strategy, operations, product management, defense consultant. Appeared in Observer, TechCrunch, NYT, Pando, Fader, Small Wars Journal.",1696,881,108,21859,2277,2008-02-22 23:52:29,FALSE,"http://www.shloky.com","TechCrunch"
"84","dfeldman","Dave Feldman","San Francisco, CA (37.793357,-","VP Product Design at Heap in San Francisco. Former PM and design manager at Google, Facebook, TechCrunch, Emu, Yahoo. Behavioral science enthusiast. I’m hiring.",1726,154,114,3266,110,2007-03-27 00:24:16,FALSE,"https://dfeldman.co","TechCrunch"
"85","JoyceInNYC","Joyce Yang 🧘","","I like to think about technology cross borders. Now @GlobalCoinRsrch @blockchainsfor @TheInformation, formerly @Techcrunch @Harvard, 👼 investing @globalcoinvc",2668,739,59,1730,2992,2018-11-03 20:38:50,FALSE,"http://GlobalCoinResearch.com/ethics","TechCrunch"
"86","veanne","veanne cao (高雾)","Brooklyn, NY","Video Director @TechCrunch",511,103,10,465,62,2008-05-20 07:02:28,FALSE,"http://instagram.com/veanne","TechCrunch"
"87","CGates123","Christopher Gates","Oakland, CA","TechCrunch | Producer of Equity Podcast | #equitypod | @TechCrunch https://t.co/KM9y3FC3W9",238,824,2,244,934,2017-12-14 18:33:21,FALSE,NA,"TechCrunch"
"88","TechCrunchIndia","TechCrunch India","","Stay tuned for official updates from TechCrunch India!",1627,60,56,1373,78,2013-07-05 06:39:55,FALSE,"http://techcrunch.com","TechCrunch"
"89","techcrunch_com","TechCrunch","","update news of TechCrunch",994,1686,63,1573,0,2010-02-27 09:27:12,FALSE,NA,"TechCrunch"
"90","Techcrunch_News","Technology News","","The latest on TechCrunch",320,488,10,5443,0,2009-05-23 19:09:53,FALSE,NA,"TechCrunch"
"91","RSS_TechCrunch","RSS_TechCrunch","","",1238,1,55,16367,0,2007-10-01 17:32:44,FALSE,NA,"TechCrunch"
"92","NikMilanovic","Nik","New York, USA","Fintech enthusiast. Building @Google, writing @Techcrunch.

// Previously @Petal, @FundingCircle, & @Stanford",1835,267,57,2464,10144,2010-08-03 05:29:59,FALSE,"http://www.thisweekinfintech.com","TechCrunch"
"93","wylcommunity","Whose Your Landlord","in your neighborhood","empowering & informing the rental community. Review your landlord & find your next home. As seen on @Blavity, @NowThisNews, @MSNBC, @TechCrunch, @BET",1489,417,28,3028,1617,2012-09-19 17:45:19,FALSE,"https://linktr.ee/wylcommunity","TechCrunch"
"94","crunchcam","TechCrunch CrunchCam","In the Cloud","Follow this account for future games we play and mayhem we ensue.",368,13,33,26,0,2009-05-09 17:01:24,FALSE,"http://tcrn.ch/1hD","TechCrunch"
"95","tpopomaronis","Tom Popomaronis","New Market, MD","Contributor, world-class leadership @CNBCMakeIt @entrepreneur. VP, Innovation @massivealliance. As seen on @forbes @inc @businessinsider @techcrunch",5002,2249,88,2857,6439,2010-10-22 05:47:00,FALSE,"http://linkedin.com/in/tpopomaronis","TechCrunch"
"96","1JMDonald","JM","New York, NY","Audience & Business Development at @TechCrunch | @ExtraCrunch",156,18,1,351,395,2019-04-27 14:48:00,FALSE,NA,"TechCrunch"
"97","topmobilecrunch","TechCrunch","","",279,39,14,1052,0,2010-01-01 18:28:09,FALSE,NA,"TechCrunch"
"98","alangdunn","Alan Dunn","","Father, Founder, Investor, Domain Name Nerd. Published on TechCrunch, Quartz, Business Insider. Podcast @domainstories. Random Dad tweets for archived fun.",1710,548,34,1415,9818,2010-08-24 12:58:50,FALSE,"http://namecorp.com","TechCrunch"
"99","scottabade","Scott Bade","Bay Area","Co-author More Human, contributor @TechCrunch. Formerly @PeteForAmerica, speechwriter and aide to @MikeBloomberg @BloombergDotOrg, @StanfordCISAC.",292,533,6,4604,3597,2014-07-18 23:59:54,FALSE,"http://amzn.to/2lnzBfJ","TechCrunch"
"100","mscaitlinbrown","Caitlin Brown 🗽","LA // East Coast","unlocking total health w/ @biostrap • ''You're like @TechCrunch meets @TMZ'' -@zarreeny",2192,987,91,5826,41716,2009-03-03 16:18:24,FALSE,"http://bit.ly/caitlinbrown","TechCrunch"
"101","geneteare","Gené Teare","Palo Alto","Deep in data @Crunchbase speaker/moderator. Writer of the Seed Series for @CrunchbaseNews. Cover venture, women in tech, women in venture / @TechCrunch alumn",1459,1013,86,605,574,2008-06-07 02:56:42,FALSE,NA,"TechCrunch"
"102","ladycvillarreal","Chrystine Villarreal","California, USA","Proud mother// President of MIXhalo, former content curator for @TechCrunch // Driven by equity and equality",431,597,14,295,299,2009-11-13 22:28:42,FALSE,"http://www.mixhalo.com","TechCrunch"
