"","screen_name","name","location","description","followers_count","friends_count","listed_count","statuses_count","favourites_count","account_created_at","verified","profile_expanded_url","outlet"
"559","VergeLearning","Erin Croley","St. Louis, MO","Curriculum Coordinator for Social Studies & English Language Arts. Passionate about Educational Equity. Nerd. Car Singer. Runner. Jedi Mom. Views are my own.",239,502,14,646,321,2013-07-13 16:46:39,FALSE,NA,"TheVerge"
"560","verge59","Verge","","Die hard Gooner, Season ticket holder to the greatest team in the world The mighty Arsenal! #lattefirm",228,452,2,810,747,2011-04-12 19:22:31,FALSE,NA,"TheVerge"
"561","vrgbls","Verge Bliss","Van Nuys, Los Angeles","ASMR Magickal Tools on YouTube
Dendera Bloodbath -- darkwave and harsh noise in SFV
Photos by Angela Izzo, izzoimages@gmail.com",605,499,7,2007,561,2013-10-31 16:58:56,FALSE,"http://www.clandestineritual.com","TheVerge"
"562","loudmouthjulia","Julia Alexander","Brooklyn","Professional serious taker of unserious things @verge I think and write about the business of shit we watch with an internet connection, from Disney+ to YouTube",18486,792,382,2660,27633,2011-09-07 17:41:22,TRUE,NA,"TheVerge"
"563","seaverge5","Sea Verge Apartments","385 Ocean Blvd Long Branch NJ ","Sea Verge offers apartment rentals directly on the oceanfront.The building faces the beach on the Jersey Shore. seaverge@propemail.com",824,1284,6,3809,11,2012-10-08 15:15:02,FALSE,"http://www.seaverge.com","TheVerge"
"564","noodlesverge","Bud Verge","Silver Spring, MD","things i love: music, eating, good beer, working out, my wife, and Bosley the basset hound. the order changes daily! (Opinions are my own.)",194,339,3,1373,9646,2011-03-04 10:51:09,FALSE,NA,"TheVerge"
"565","JenontheVerge","JenOntheVerge","","Not always witty, not always fabulous, but I guarantee always on the verge of something.",259,555,7,1637,6101,2008-07-01 19:58:13,FALSE,NA,"TheVerge"
"566","crumbstick","On The Verge of Want","","A recovering upholsterer on a bind-mending journey.",249,539,3,4729,9180,2014-09-26 13:27:07,FALSE,NA,"TheVerge"
"567","VergeLabsAI","Verge Labs","","Research, advice and algorithms you can apply to your business today",123,59,2,76,41,2018-01-30 02:45:16,FALSE,"http://vergelabs.ai","TheVerge"
"568","SirVerge23","Vergel S. Quiazon","Angeles City, Central Luzon","Educator; Music Enthusiast; Optimist",627,448,0,3669,2381,2016-11-01 06:23:31,FALSE,NA,"TheVerge"
"569","VergeBooksChi","Verge Books","Chicago, IL","We are a Chicago-based small press committed to publishing poetry and translation.",100,53,4,133,441,2015-11-05 14:20:25,FALSE,"http://vergebooks.com","TheVerge"
"570","vergegreeley","Verge Greeley","Greeley Colordao","Fully Loaded College Living In Greeley CO!",386,358,2,2004,634,2011-08-04 19:49:45,FALSE,"http://thevergegreeley.com/","TheVerge"
"571","EmVergeL","Vergel  Encarnacion","Rosario Cavite","• ECE Graduate
• IG: EMVERGEL",693,438,2,22405,34722,2010-02-17 05:38:33,FALSE,NA,"TheVerge"
"572","aleciaaaaa23","Alecia Verge 💫","","REST IN PARADISE GRANDPA 💙",971,891,1,5778,7636,2012-06-20 03:33:52,FALSE,NA,"TheVerge"
"573","Verge_forums","Verge Forums","","Verge Forums twitter handle. Join many discussions on our forums about recent updates, price, market, mining & anything else related to Verge.",741,55,6,171,223,2017-12-01 02:34:08,FALSE,"https://forums.vergecurrency.com/","TheVerge"
"574","MrVergePhysEd","Braden Verge","","Teacher of Physical Edutainment, husband, father, sports enthusiast, lover of the outdoors, lacrosse player, and burger connoisseur. “We live to get RADICAL”",279,1426,4,1282,7044,2015-11-21 20:07:53,FALSE,NA,"TheVerge"
"575","dcseifert","dan seifert","New York","Deputy Editor, @verge. I run our product reviews program because what can I say, man? I'm a gear head, I love gack",32622,632,1000,1773,26664,2009-08-05 03:59:33,TRUE,"http://www.theverge.com/reviews","TheVerge"
"576","TrishKKP","Trish Walsh-Verge","Prince Edward Island, Canada","I am passionate about the print/sign industry. I enjoy relationships with clients and working with them on whatever project or event they need our services for.",198,190,2,137,1099,2013-10-15 14:38:27,FALSE,"http://kkpei.ca","TheVerge"
"577","laura_hudson","Laura Hudson","Los Angeles, CA","Editor & writer of things, now TV & video games. Hirable. Previous work @ Wired, Verge, NYT, 538, Offworld, Femfreq. Chaotic good, optimistic cynic, total champ",32931,1575,1053,2313,54706,2008-07-29 04:32:43,TRUE,"http://laurahudson.me","TheVerge"
"578","iverge","Verge Manuel","Toronto, Canada","entrepreneur | travelholic | cupcake guru | find me",79,114,6,269,212,2009-04-18 07:09:08,FALSE,NA,"TheVerge"
"579","gallery_verge","Verge Gallery","Sydney, New South Wales","Verge Gallery at the University of Sydney (USyd) is a public art space dedicated to the presentation of Contemporary art practice.",103,372,0,82,84,2019-02-12 03:07:58,FALSE,"https://verge-gallery.net/","TheVerge"
"580","VergeSense","VergeSense","San Francisco, CA","#AI-Powered Sensor-as-a-Service platform used for building management and commercial real estate. Backed by @ycombinator.",272,500,8,643,245,2017-06-13 05:08:36,FALSE,"https://www.vergesense.com","TheVerge"
"581","FemOnTheVerge","Queenie Tea","Midlands","A permanent floating biscuit in the tea cup of politics....life....ART.",216,519,6,263,84,2011-02-27 15:09:05,FALSE,NA,"TheVerge"
"582","NtokzinVerge","Ntokozo Mkhize","Durban, South Africa","",372,2209,0,1556,1793,2010-01-14 11:44:12,FALSE,NA,"TheVerge"
"583","JesseDamiani","Jesse Damiani","Views mine. He/him.","Emerging media @Forbes. Bylines @WIRED, @verge, @qz, others. Director of Simulation Literacies @NxtMuseum. Dep. Director of Emerging Technology @SNHU.",11427,593,337,11736,17923,2013-03-14 19:15:23,TRUE,"https://damiani.substack.com/","TheVerge"
"584","sokane1","Sean O'Kane","Austin, TX","Senior reporter at @Verge covering tech and biz of transportation startups, EVs, Tesla, & more. | 📨 sean.okane@theverge.com, DM for Signal, etc. | #VoxUnion",15819,3165,466,102370,45291,2008-02-07 16:14:50,TRUE,"http://seanokanephotos.com","TheVerge"
"585","VergeBulgaria","Verge | Bulgaria","Bulgaria","[Verge Official, Bulgaria] Анонимност, сигурност, светкавични транзакции                                             Tor/i2p #Verge #XVG",332,29,2,330,307,2017-09-07 21:13:07,FALSE,"http://www.vergecurrency.com","TheVerge"
"586","FreeVerge","Brian Bass","Dallas, TX","Programmer",246,1155,15,418,38,2009-11-19 05:35:37,FALSE,NA,"TheVerge"
"587","italia_verge","VergeItalia","Italy","Official Italian #Verge #XVG #VergeItaly News e Info / Support the project.. Verge tips are welcome  DU8qDdeKRG8mHSbj36AjxHJFSKozJ6mbpT",645,441,0,256,795,2018-02-26 18:03:03,FALSE,"https://vergecurrency.com/","TheVerge"
"588","amysoo","Amy Soo Verge","san diego ca","Test Director Navy Global Command and Control System-Maritime",14,117,0,124,76,2009-03-04 00:14:22,FALSE,NA,"TheVerge"
"589","KuraClinic","Alexandra Verge","Guelph, Ontario, Canada","Naturopathic Doctor, Owner/Clinic Director of Kura Naturopathic Clinic and RMT, Hiker, Pet Wrangler, Avid Reader, Vegetable Lover",238,285,16,885,968,2013-04-09 00:02:19,FALSE,"http://www.kuranaturopathic.ca/our-team/alexandra-verge-b-sc-nd/","TheVerge"
"590","gary_verge","Gary Verge","Inglewood, CA","Mr. keep it 100. If you are a seeker of truth then I am your man. Proud of the skin that I'm in playing the game of life and I'm determined to win.",27,526,0,90,424,2018-10-29 03:39:19,FALSE,NA,"TheVerge"
"591","VergeScientific","Verge Scientific","Washington, DC","Verge Scientific is a strategic communications consultancy shaping the stories of emerging and pioneering health companies.",98,231,3,118,247,2016-02-11 21:28:32,FALSE,"https://www.vergescientific.com/","TheVerge"
"592","djverge_sa","Dj Verge","Durban, South Africa","Professional DJ/Runs a successful DJ school in Durban  📱 Bookings : 0781964494                  📧 djvergefellaz@gmail.com",498,141,0,114,28,2015-07-23 07:39:00,FALSE,NA,"TheVerge"
"593","reckless","nilay patel","Brooklyn, NY","Editor-in-chief of The Verge. CNBC contributor. Host of The Vergecast, everywhere good podcasts are served. I am in love with spectacle.",141845,1985,4943,648,32517,2007-04-05 06:32:55,TRUE,"http://theverge.com","TheVerge"
"594","dj_stumbah","#THE_VERGE♣","United States","dj stumbah is a beat maker who originates from Capetown versatile for hes  beat making skill. credited for #Sweet_Chilli #Sebenza #TheyDontKnow #Shabang",1132,1722,3,1059,89,2012-09-26 20:23:46,FALSE,NA,"TheVerge"
"595","ShellOnTheVerge","Shelstar","Planet Earth","Masseuse supremo and wellbeing promotor; Tory hating, music loving, wana be hippy throwback. 🌈 #WeAreOne",438,969,2,2685,6618,2017-05-06 22:35:13,FALSE,NA,"TheVerge"
"596","JenVerge","JenniferVergeArt","","Urban Artist & Designer",84,89,4,422,102,2009-03-12 23:21:43,FALSE,"http://www.jenniferverge.com","TheVerge"
"597","chrisgrant","chris grant","E1M1","SVP @voxmediainc, @polygon & @verge

wielder of the controller, Real Gamer",23816,1068,838,921,9964,2007-03-21 02:22:32,TRUE,NA,"TheVerge"
"598","HarryVerge","Harry Verge 🇨🇦 🇮🇱","","When it comes to the UN, the lunatics are definitely running the asylum. Defund this antisemitic nut house. Boycott the boycotters.",336,1457,2,14855,38652,2013-01-20 16:51:06,FALSE,NA,"TheVerge"
"599","knguyen","Kevin Nguyen","Brooklyn, NY","author of New Waves. features editor @verge. everything is embarrassing.",32783,1757,448,9301,73427,2007-04-01 16:58:55,TRUE,"https://newwaves.website/","TheVerge"
"600","vergepng","VERGE PNG","Papua New Guinea","📍 Papua New Guinea 🇵🇬 Design-driven Brand Innovation and Results-focused Digital Marketing Agency | Taking businesses and brands #BeyondTheLimits",180,373,1,255,728,2017-01-12 19:26:02,FALSE,"http://www.verge.com.pg","TheVerge"
"601","JonPorty","jon.porter","London, UK","Reporter @Verge and Dead German Soldier #4 in Wonder Woman. He/Him.",3043,1122,62,4122,4194,2010-03-08 20:47:14,TRUE,NA,"TheVerge"
"602","kwameopam","Kwame Opam","New York","Senior Editor, Digital Storytelling @nytimes. Talk to me about breaking news. Formerly @verge. Black. Nerd. He/Him. Wakanda forever.",10914,1368,329,5330,23133,2009-02-12 22:49:34,TRUE,NA,"TheVerge"
"603","VergeGold","VERGO","","",1068,19,1,13,3,2019-06-24 03:00:38,FALSE,"https://verge-gold.com/","TheVerge"
"604","VergeMontrez","816trez","Kansas City, MO","IG  @chill816trez",518,520,0,1280,3065,2018-06-03 04:09:53,FALSE,NA,"TheVerge"
"605","womenverge","Women on the Verge","Prince Edward County, Ontario","Classical vocal trio of sopranos Emily Martin & Elizabeth McDonald and pianist Kathryn Tremills dedicated to telling the stories of women’s lives in song.",161,209,0,53,48,2017-06-07 20:33:10,FALSE,"http://www.womenontheverge.ca","TheVerge"
"606","EllieVerge98","Ellie Verge","","",360,564,0,5922,1928,2011-03-19 22:02:53,FALSE,NA,"TheVerge"
"607","MomOnTheVergeOf","On the Verge","","Old age and treachery will always overcome youth and skill. (She said confidently.)",173,366,0,15596,28333,2009-09-01 15:47:56,FALSE,NA,"TheVerge"
"608","VergeXVGerman","Verge | German","Germany | Austria | Switzerland |  Lichtenstein | Luxembourg","Der deutschsprachige Twitter Kanal von #Verge (#XVG).",382,3,0,77,154,2018-07-24 10:22:29,FALSE,"https://vergecurrency.com/","TheVerge"
"609","MomOnTheVerge","Donna","Southern California","Always on the verge of everything.  Mom, Wife, Wisdom Seeker,Pre-nomad Traveler,Writer, Foodie and TV Producer.",3916,4560,281,15163,173,2009-05-29 16:18:42,FALSE,"https://www.facebook.com//MomsOnTheVerge","TheVerge"
"610","FilmCritHULK","Film Crit Hulk","Avengers HQ","Writing essays! Patreoning. Bylines at Polygon. Observer. Vulture. Verge. EW. New Yorker. Playboy. Thrilllist. Contact: filmcrithulk@gmail.com",72370,2226,1256,54950,46430,2010-05-18 19:28:11,FALSE,"https://www.patreon.com/filmcrithulk","TheVerge"
"611","GoBrandVerge","BrandVerge","New York, NY","The only platform that makes it easy to plan premium media partnerships. Our marketplace takes advertisers from discovery to final program in a few easy steps!",47,186,1,247,35,2017-11-19 18:41:02,FALSE,"http://www.gobrandverge.com","TheVerge"
"612","VergeSpirit","XVG_Spirit  | @VergeSpirit","On_Moon_Soon","XVG, acronym for Verge Currency.

Privacy coin ready for mass adoption.

Official website: https://t.co/C9rqk9g1H7

Attention, GIVEAWAYS ARE FAKE AND SCAMS !",603,250,0,436,1349,2018-03-06 15:03:24,FALSE,"http://Vergecurrency.com","TheVerge"
"613","VergeOfVicious","KINGMITCH","Everywhere.","Word play king im not the one to scrabble with
I'm just trying to be real in a world that's mad fake
IG: thepipedpiper",190,264,2,17708,1,2011-02-21 06:36:38,FALSE,NA,"TheVerge"
"614","onthevergecambs","On The Verge Cambridge","Cambridge, England","We promote the growing of nectar-rich wildflowers around Cambridge city.",137,15,0,84,174,2019-10-05 17:48:13,FALSE,"http://www.onthevergecambridge.org.uk","TheVerge"
"615","VPoney","Verge De Poney 👽🇫🇷","Zaap Astrub","Si les meilleurs partent en premier alors je suis immortel.",21,406,0,915,9109,2018-08-29 20:54:46,FALSE,NA,"TheVerge"
"616","fincludeAI","Finclude (fka. Verge.Capital)","Europe","Financial Well Being Reinvented | Enabling fair access to #credit | #FinancialInclusion | #CreditRisk | #Fintech",58,64,3,77,222,2018-07-03 07:58:51,FALSE,"https://www.finclude.ai","TheVerge"
"617","Quinnae_Moon","Katherine Cross","Seattle, WA","Sociologist, Gaming and Social Critic; Techie TransLatina; words in @Gamasutra | @Verge. Scholar @UW_iSchool; Ethics in Tech.",25182,974,526,69383,131396,2010-11-08 04:40:42,TRUE,"http://quinnae.com","TheVerge"
"618","onthevergeaus","On the Verge","Sydney, New South Wales","sydney alt-rock",161,279,3,195,636,2017-01-03 11:44:17,FALSE,"https://linktr.ee/onthevergeaus","TheVerge"
"619","VergeVideo","Verge Video","","The latest updates from the award-winning Verge Video team delivered right to your Twitter feed.",6207,50,181,632,17,2013-04-08 14:19:27,TRUE,"http://www.YouTube.com/theverge","TheVerge"
"620","katiefehren","Katie Fehrenbacher","San Francisco","Senior Writer covering clean transportation & climate tech, current: GreenBiz, VERGE; former: Fortune, Gigaom, Red Herring",26903,1480,1556,22755,10779,2007-02-10 23:17:19,TRUE,NA,"TheVerge"
"621","1TheVerge","jeremyschering","Valparaiso, IN","Producer and musician... if pressing the spacebar counts.",127,259,2,1243,4089,2008-12-30 02:58:13,FALSE,NA,"TheVerge"
"622","VergeEllensburg","The Verge Ellensburg","Ellensburg, WA","It's a great day here at the Verge in Ellensburg! Welcome to all inclusive off campus student living. Stay updated on our upcoming events & other information😎",245,342,0,3663,400,2011-04-06 20:59:46,FALSE,"http://Linktr.ee/VergeEllensburg","TheVerge"
"623","VergeLeNoir","VergeLeNoir","New York, N.Y.","Ubi panis ibi patria. Writes #crimefiction with healthy spatters of humor. TWO IGUANAS LOUNGE out now: https://t.co/ueAs8i9nMn",3320,3294,29,4930,7287,2012-09-11 05:26:11,FALSE,"https://books2read.com/ap/ng5YEx/Verge-Le-Noir","TheVerge"
"624","BSLOnTheVerge","The Verge- An Orioles MiLB Podcast","A minor league ballpark","A weekly podcast about the Baltimore Orioles minor league system. Part of the @BmoreSportsLife network. Co-hosts Bob Phelan, Zach Spedden, and Nick Stevens",138,190,3,343,406,2020-02-16 16:10:04,FALSE,"https://podcasts.apple.com/us/podcast/the-verge-bsl-radio/id1498988870","TheVerge"
"625","bcbishop","Bryan Bishop","Los Angeles","Immersive and fully interactive. WDI R&D. Past: @ILMxLAB / Lucasfilm / @Verge. Tweets are my own.",8471,910,360,758,8974,2008-07-11 18:38:34,TRUE,NA,"TheVerge"
"626","DJUncleVerge","DJ Uncle Verge","United States","I'm a radio DJ from NC. Know for the famous OVERDRIVE PARTY. The new hot DJ of Southern Soul Blues...",108,279,1,35,1,2011-05-22 21:31:53,FALSE,"http://djuncleverge.com","TheVerge"
"627","ParentsVerge","Parents on the Verge","Walthamstow, London","✨An honest approach to parenting ✨Finding ways to slow down + not melt down✨Talking #mentalhealth and #parenthood",174,134,0,681,477,2019-04-10 17:34:49,FALSE,NA,"TheVerge"
"628","exverger","VERGE♀♀♂♂♀♂","KENT/ LONDON  ENGLAND","man of kent  not kentish man  nature lover no ones other 
 Most what I say is ether stupid or rubbish or both♂♂♀♀☺ #HPCorp Member ☺♥☺♥& KEEP MUSIC  LIVE♫♪♫♪•☻☻",243,225,2,18635,559,2011-05-06 19:25:05,FALSE,NA,"TheVerge"
"629","TpayVergeHellas","TpayVergeGreece","Ελλάς","",281,503,0,2319,1984,2017-12-24 14:26:43,FALSE,NA,"TheVerge"
"630","patverge","Pat Verge","Canada","",160,484,2,182,5736,2009-04-26 19:13:40,FALSE,NA,"TheVerge"
"631","VergeAgro","Verge","Calgary, Alberta","Software for producers. Our product easily integrates into equipment and helps to optimize field operations, visualize path plans, and maximize productivity.",212,275,3,178,648,2019-06-10 17:27:16,FALSE,"https://vergeag.com","TheVerge"
"632","danideahl","Dani Deahl","Insta and snap: danideahl","DJ/producer | @recordingacad Vice President, Chicago chapter | Future of Music host @verge | Previously: @djmag @nylon

Text me: (312) 847-2506📲",14682,1092,308,40207,46191,2008-03-06 21:03:04,TRUE,"http://www.danideahl.com","TheVerge"
"633","chriswelch","Chris Welch","Crown Heights, Brooklyn","Editor @Verge. DMs open. welch@theverge.com Signal: 845-445-8455 #voxunion",9837,1828,428,449,10540,2008-01-16 06:48:31,TRUE,"http://instagram.com/chriswelch","TheVerge"
"634","adrjeffries","Adjusted Ebitdac Jeffries","la gran manzana","reporter @themarkup, co-host @underunderstood | ex @motherboard @verge @outline | adrianne@themarkup.org signal 614-347-9853 adrjeffries@xmpp.jp or DM me here",22226,821,955,156,7910,2008-09-04 17:21:15,TRUE,"http://adriannejeffries.com","TheVerge"
"635","StarFire2258","Sean Hollister","California","Run news at @Verge. (DM me for Signal.) Former @CNET @Gizmodo @Engadget. Avid gamer, lucky husband, happy dad! Maybe too blunt. Note: Wife works at Facebook.",12175,1732,587,24624,8327,2007-03-25 05:45:42,TRUE,"https://www.theverge.com/users/Sean%20Hollister","TheVerge"
"636","nattgarun","Natt การุณรังษีวงศ์","NYC (now) ✈ Bangkok (birth)","thai fighter | american immigrant | #mejournalist @verge (currently on furlough) | dreams in InDesign | header photo by @dami_lee",7146,707,337,28324,7705,2009-05-22 08:47:38,TRUE,"http://support.pancan.org/site/TR?fr_id=1682&pg=personal&px=1329995","TheVerge"
"637","Tre_verge","Tr'e","","the name is Tr'e & I model .. my inspiration is within the camera.  I do what makes me happy & i am who I am nomatter  #TeamFollowBack #brownSkin #teamModel",266,515,4,5698,45,2010-12-28 22:16:33,FALSE,"http://www.facebook.com/KiddFlaw","TheVerge"
"638","Vergebeliever","Verge Believer","","XVG believer that posts the latest news/developments of the next global currency. xrptipbot://twitter/Vergebeliever",453,74,2,2118,2115,2018-02-13 21:09:57,FALSE,NA,"TheVerge"
"639","andyjayhawk","Andrew J. Hawkins 🚇🚌🚲🛴","new york","Senior transportation reporter at @verge / andrew.hawkins(at)https://t.co/DY1lI9NeaC / @vox_union",12500,5532,509,30804,10699,2009-02-18 16:05:24,TRUE,"http://www.theverge.com","TheVerge"
"640","verge_rpg","VERGE-RPG","St. lou","Free jRPG creation since 1997 ⚔️🛡️⚔️http://verge-rpg.com2E",29,41,0,12,39,2017-09-03 22:57:23,FALSE,NA,"TheVerge"
"641","VergeMarieLayno","Verge Marie Layno","Republic of the Philippines","Industrial engineer. Adventure seeker.
Artist & blogger.",166,248,0,2047,3274,2014-04-23 02:30:04,FALSE,"https://verjmari.blogspot.com","TheVerge"
"642","richmcc","Rich McCormick","Kyoto","Producer @17_BIT. Previously, @verge and @pcgamer.",3401,624,132,12896,1279,2009-02-13 22:20:56,TRUE,"http://17-bit.com/","TheVerge"
"643","russellbrandom","Russell Brandom","New York, NY","Policy editor at @verge. Drawn up all my findings, and I warn you they are candid. Tips: https://t.co/OzKi9cCnEA",10462,2239,442,22865,46745,2010-08-23 20:09:43,TRUE,"http://www.theverge.com","TheVerge"
"644","Kiey","D.M. Moore","NYC","Currently furloughed @Verge writer. You can find my freelance and other writing for now at https://t.co/TVzkqlTliE | Ko-fi: https://t.co/RgQtpPu4Iz",2087,310,74,22487,10396,2008-04-22 19:09:17,TRUE,"https://awaytext.blogspot.com/","TheVerge"
"645","VergeMobileTPR","Verge Mobile","Houston, TX","T-Mobile Premium Retailer",261,159,1,351,1585,2014-04-25 18:21:27,FALSE,"http://www.vergemobile.com","TheVerge"
"646","vergemodelsncat","Verge Modeling Troupe","Greensboro, NC","Award Winning Verge Modeling Troupe at North Carolina A&T. Do you have what it takes to be a Diamond? 💎",154,114,0,127,99,2017-04-28 21:35:12,FALSE,"http://Instagram.com/vergemodels_ncat","TheVerge"
"647","VergeSuomi","Verge | Finland 🇫🇮","Suomi","Verge $XVG | Turvallinen, anonyymi kryptovaluutta, joka keskittyy yksityisyyteen. Virallinen suomalainen twitter-tili. https://t.co/esUPTQrqP3",186,125,3,411,1132,2018-02-12 07:24:14,FALSE,"http://vergecurrency.com","TheVerge"
"648","TashaRobinson","Tasha Robinson","Chicago, IL","@Polygon Film/TV Editor. Former editor at The Verge, The Dissolve, The A.V. Club. @NextPicturePod podcaster. My wheelhouse is full of weird stuff.",24143,773,739,34420,1203,2008-12-31 22:36:43,TRUE,"http://www.theverge.com/users/Tasha%20Robinson/posts","TheVerge"
"649","VergeSupport","Verge Support","","Support team for @verge. Given Tweet volume, we might miss a tweet here or there. If we miss yours, shoot a note to support@theverge.com. Thanks!",2151,0,75,2404,13,2011-10-12 17:07:04,FALSE,"http://theverge.com","TheVerge"
"650","vergepictures","Verge Pictures","Spokane, WA","Story Over All",42,237,0,195,765,2016-04-17 16:54:11,FALSE,"https://verge.pictures","TheVerge"
"651","nickstatt","Nick Statt","San Francisco, CA","Reporter / News Editor @verge & slayer of grilled cheese sandwiches. I write about the future and sometimes video games.",8274,1000,415,393,4352,2009-03-10 18:26:43,TRUE,NA,"TheVerge"
"652","chillmage","tc","","executive editor @verge. creator of @questrpg",17976,1,505,214,18295,2009-02-17 14:52:13,TRUE,"http://www.adventure.game","TheVerge"
"653","VergeAwards","YourStage","","Online (FREE) stage for teenage singers, dancers, artists, inventors, athletes, changemakers; weekly variety shows raise funds for great causes! https://t.co/yi8NkeKVbQ",254,268,3,86,77,2013-09-16 02:47:10,FALSE,"https://www.vergeawards.org/","TheVerge"
"654","lorengrush","Loren Grush","New York, NY","Senior science reporter at @verge, covering all things space. Host of #VergeSpaceCraft. Texas-bred: Clear eyes, full hearts. loren.grush+tips@theverge.com",43787,1078,1150,16472,6938,2008-11-05 02:21:59,TRUE,"https://www.theverge.com/authors/loren-grush","TheVerge"
"655","kellymakena","Makena Kelly","she/her","tech reporter @verge • 📱 signal: 585-412-2148 • 💌: makena.kelly@theverge.com •",5670,2519,119,6636,19591,2017-01-20 00:40:04,TRUE,"http://www.theverge.com/authors/makena-kelly","TheVerge"
"656","Pokachee","Ana Diaz","minneapolis","internet gremlin😈 / social @heyglitch + host of Refreshed @MinnMaxShow / prev. @polygon / seen @unwinnable, @verge / latinx / i use she/her",1343,652,21,2870,11648,2013-05-27 23:03:59,FALSE,"http://anadiaz.org","TheVerge"
"657","MicahSingleton","Micah Singleton","✈","@billboard @medium @verge alum",4599,291,193,718,10888,2011-07-18 16:08:14,TRUE,"http://micahsingleton.com","TheVerge"
"658","A_Webster","andrew webster","hamilton","verge games editor // we apologize for the inconvenience",5121,1403,234,45224,538,2008-05-02 13:09:44,TRUE,"https://www.theverge.com/games","TheVerge"
"659","ChrisVerge1","Chris Verge","","Father, Husband, Engineer, Civil Servant #legowithmy4yrold #NSroadconstruction",110,498,17,3198,26,2013-12-11 17:47:43,FALSE,NA,"TheVerge"
"660","Z_Verge","Zach🧊","","When the goin' gets tough... Get tougher ______ Insta📸: zverge_7",260,263,4,2320,10166,2013-10-30 17:17:32,FALSE,NA,"TheVerge"
"661","VergeOfVertigo","Vertigo","","Gakkou Gurashi Enthusiast / I just want Tales in Smash Bros already / Twitter bots ruined my life and sanity",376,275,13,4366,18191,2014-09-09 23:17:17,FALSE,NA,"TheVerge"
"662","jake_k","Jake Kastrenakes","Brooklyn, NY","@verge reports editor, the ending to lost was good. contact me: https://t.co/G6H0msp1cq",7216,404,323,9156,6879,2007-08-07 02:17:20,TRUE,"http://theverge.com","TheVerge"
"663","dogeatdogpoop","Andrew Verge","BC","Former professional Mascot (Seriously) Announcer, Writer, Musician, Comedian, Entrepreneur and Jack of some trades",98,610,8,567,205,2012-03-21 06:31:34,FALSE,"http://www.comedyontheverge.com","TheVerge"
"664","Vergeatl","Verge Painting","Marietta, GA","Your premier Atlanta painting, siding and decking company. Great pricing and even better quality. 678-331-1102",101,123,2,773,28,2011-05-25 16:10:47,FALSE,"http://vergeatl.com","TheVerge"
"665","VergeCurrency_","VergeFamily","","NOT OFFICIAL ACCOUNT!!!
@VergeCurrency $XVG #VergeFam.
Verge fulfills decentralization and anonymity.  
Donations XVG wallet: DPKGS4qcSCVECFs2ZmTU1HWFkALi4jGLTC",455,0,2,3966,0,2017-06-10 19:46:38,FALSE,NA,"TheVerge"
"666","MemVerge","MemVerge","","",98,52,8,51,6,2019-02-14 00:39:29,FALSE,NA,"TheVerge"
"667","wat_son4","W∆nder vêrge♨️","Dormaa Ahenkro, Ghana","Be mindful. Be grateful. Be positive. Be true. Be kind💯🔥
                       ..... Watson",441,1052,0,2044,3923,2019-10-07 01:20:37,FALSE,NA,"TheVerge"
"668","JRRaphael","JR Raphael","The Interwebs, U.S.A.","Writer. At large. @AndroidIntel + Computerworld, Fast Company, The Verge, and beyond.

Get my weekly newsletter: https://t.co/JOReRXL2O7",13643,368,971,17679,3348,2009-03-12 22:56:45,TRUE,"https://JRStart.com","TheVerge"
