"","screen_name","name","location","description","followers_count","friends_count","listed_count","statuses_count","favourites_count","account_created_at","verified","profile_expanded_url","outlet"
"895","DzCactus","JR Dziengel","Los Angeles, CA ","Doing my Best to do my Best. On the verge of sharing Bastard the film. https://t.co/B5PIiKJVWO Make My Day: Visions, LLC Go Cubs!",816,1489,8,2559,4338,2011-11-02 18:08:55,FALSE,"http://www.makemydayvisions.com","TheVerge"
"896","VergeSport","Verge Sport","Worldwide","Premium Custom Apparel",1092,651,36,2943,151,2010-01-20 22:32:49,FALSE,"http://www.vergesport.com","TheVerge"
"897","LakitaWrites","Lakita Wilson","Washington, DC","🙋🏽‍♀️ MG & YA #kidlit writer. 2017 #SCBWI On-The-Verge Emerging Writer Winner #VCFAWCYA Student 🏆 Repped by @WellMelsBells at @RootLiterary",704,493,17,2252,7537,2017-04-14 15:06:25,FALSE,"http://www.LakitaWilson.com","TheVerge"
"898","hermayonnaise_","toot toot","Lahore","on the verge of insanity 











Snapchat: hermeenshahid",1377,273,8,22702,34225,2012-10-09 11:36:58,FALSE,"http://www.instagram.com/hermeenshahid","TheVerge"
"899","fatgirlclothes","Fat Girl Clothes","UK","Woman on the verge of reaching her full potential. PS fashion blogger, clothing designer, vintage trader and general lover of life.
NEW WEBSITE! Please see link",1511,892,72,1688,1131,2012-08-27 14:47:41,FALSE,"http://pareepeople.etsy.com","TheVerge"
"900","KrysSebastian","Sebastian J Krys","Candy Kingdom","Driven eccentric. Father. Engineer. Author of ""Verge"". Love laugh #music #writing #painting also fan of #mythology #psychology #history #genetics and #robotics.",2243,1997,29,1978,5145,2016-05-01 06:30:18,FALSE,"https://www.amazon.co.uk/gp/aw/d/B073RWBSHJ?ref_=dbs_s_i_srch_l_p1_0&storeType=all","TheVerge"
"901","makingmagic","Aunt Pearl","Everywhere","Keeping alive the memories of the movies and the music that have been forgotten and those on the verge of becoming forgotten.",1522,2001,16,4726,290,2008-04-22 15:51:19,FALSE,"https://www.bitchute.com/channel/iaCpmecoYLUc/","TheVerge"
"902","VergeCat","Verge Cat","New York City, NY","I am a cat who lives @verge",49,18,0,20,1,2014-04-08 16:14:57,FALSE,"http://theverge.com","TheVerge"
"903","filmbk89","Brennan King","510","I make videos for sometimes in 1:1 but mostly 16:9. I tweet during renders and opinions are mine. past- director @verge | present- what y’all wanna do?",509,1492,22,692,8040,2009-02-19 17:25:49,FALSE,"http://hiimbrennan.co","TheVerge"
"904","EmilyFishbein11","Emily Fishbein","","Freelance journalist focusing on Kachin State, Myanmar and refugees in Malaysia. Bylines in @AJEnglish, @LATimes, @Guardian, @CSMonitor, @NAR, @SCMPNews, @verge",436,778,11,192,559,2019-06-18 04:14:42,FALSE,NA,"TheVerge"
"905","Silver_Sulfide","Verge for Life","Eindhoven","",94,252,1,887,1796,2011-08-05 22:09:55,FALSE,NA,"TheVerge"
"906","VergeKorea","Verge | Korea","대한민국 서울","Verge Korea, Official",950,433,4,135,257,2017-08-16 14:28:10,FALSE,"http://vergecurrency.com","TheVerge"
"907","luke_verge","michael luke verge","","You need to stop limiting yourself and live.",113,92,1,2388,1316,2013-01-15 02:05:45,FALSE,NA,"TheVerge"
"908","the_verge0f","Avivi","Houston, TX","Dont step on my white Vans",52,104,0,1030,3781,2016-10-01 01:27:31,FALSE,NA,"TheVerge"
"909","TheArrowman_","The Arrowman","5 miles from 8 mile","Diehard- I hold the Arrow between the uprights during a kick. Since “04”. Lions are on the verge of greatness. #trustinQuinn",2019,1627,15,20525,16671,2013-03-13 13:58:20,FALSE,NA,"TheVerge"
"910","dianaeloiselevy","Diana Eloise Levy","Los Angeles + NYC","writer + director of a feminist utopia. top 6% writer in writers on the verge.  Consulting Producer on Dead Girls Detective Agency",455,1204,3,2078,4070,2010-11-07 04:03:08,FALSE,"http://www.dianaeloiselevy.com","TheVerge"
"911","MariSeeMariDo","Mari Meyer","Los Angeles, CA","Journalist, writer, filmmaker. NL in 🇺🇸. News editor for @volkskrant, views are my own. Finalist @ATTHelloLab, Semi-finalist @NBC Writers on the Verge.",401,458,13,678,1514,2013-09-02 14:38:01,FALSE,"http://www.marimeyer.com","TheVerge"
"912","pauldendulk","Paul den Dulk","Amsterdam, Nederland","C# in all forms, serverless, maps, loves bulleted lists. Maintainer of @mapsui. On the verge of an important breakthrough for almost 30 years now.",393,1209,23,2137,1673,2008-04-16 17:22:19,FALSE,"https://github.com/pauldendulk/","TheVerge"
"913","isabellinging","Isabel Ling","","writing: @outline, @eater, @verge, @hyperallergic | slide into my dms: isabelgling@gmail.com",334,493,1,1874,5403,2013-05-22 23:43:54,FALSE,"http://isabelling.squarespace.com/","TheVerge"
"914","lirabobeera","Lira Kellerman","Helping New Actors Break In","NBC 2020 Writers on the Verge Fellow | Sinead on @YandR_CBS | #author https://t.co/wo70tJhza8 | #writer @TheCut, @InStyle, @DameMagazine, @Ravishlydotcom",526,166,32,2166,580,2008-07-19 22:51:34,FALSE,"http://thestrugglingactress.blogspot.com/","TheVerge"
"915","vergefeatured","Verge Featured","","Posts and Retweets Featured articles from the Verge home page. Unofficial.",202,1026,13,2803,7,2016-12-18 23:58:52,FALSE,"http://www.theverge.com","TheVerge"
"916","ArthurInColour","Arthur Sharpe","London, UK","Film & TV Composer: Guilt, Flowers, Ghosts, Women on the Verge, The Darkest Universe, Black Pond. (For band stuff see https://t.co/Knzv8HYBsP.)",885,522,6,185,144,2013-06-16 21:23:52,FALSE,"https://www.arthursharpe.com","TheVerge"
"917","ks_countertenor","Ks. Christopher Robson","Krailling, near Munich Germany","Middle-aged/ageing Countertenor Bayerischer Kammersänger (KS) on the verge of retirement.... well, maybe not quite yet.",998,989,18,14224,32753,2014-07-14 19:45:44,FALSE,"http://www.christopher-robson.com","TheVerge"
"918","VergeTheFilm","VERGE, The Film","New York, NY","VERGE charts the 7yr roller coaster life of drummer @5HAKERLEG & his journey from NY subway performer to signing with @TheKin a band on the brink of stardom",201,544,3,809,158,2013-05-06 21:15:13,FALSE,"http://www.vergethefilm.com","TheVerge"
"919","filmsupremacist","cassavetes'","she","go watch a 30s screwball you pussy • • •  i'm just @catarinacmrg but on the verge of a breakdown",1276,709,7,7413,14252,2017-04-30 13:54:05,FALSE,NA,"TheVerge"
"920","VergeHQ","Verge ®","Indianapolis, IN","We're now @PowderkegCo. Follow us there!",1174,482,57,5233,165,2012-07-16 17:54:29,FALSE,"http://VergeHQ.com","TheVerge"
"921","SarahMSmithers","Sarah","","Editorial Coordinator at @Verge, amateur Danny DeVito impersonator, definitely a human person and not 14 possums in a trench coat.",230,422,4,308,1340,2010-01-01 00:24:16,FALSE,NA,"TheVerge"
"922","mihael_cm","ᴍ ɪ ʜ ᴀ ᴇ ʟ","Rijeka, Croatia","#𝙱𝙻𝙾𝙲𝙺𝙲𝙷𝙰𝙸𝙽 • #𝙳𝚎𝙵𝚒 • #𝙵𝙸𝙽𝚃𝙴𝙲𝙷 • #𝙿𝚁𝙸𝚅𝙰𝙲𝚈 | 𝚃𝚁𝙰𝚅𝙴𝙻 | 𝚃𝙴𝙲𝙷𝙽𝙾 | 𝚅𝙴𝚁𝙶𝙴 [#𝚇𝚅𝙶] & 𝙲𝙾𝙸𝙽𝙳𝙰𝚀 𝙰𝙳𝚅𝙸𝚂𝙾𝚁",3291,277,11,2661,6158,2017-10-24 20:55:25,FALSE,"http://linkedin.com/in/mihaelradoslovic","TheVerge"
"923","OnRepeatRecords","ON REPEAT","london","Record label, DJ agency and music consultancy. Est. 2013 by @littleboots and @le_verge ✨ Live Pop Quiz every Thursday at 8.05pm BST",556,701,11,351,75,2013-05-22 13:18:46,FALSE,"http://www.onrepeatmusic.co.uk","TheVerge"
"924","rafenriquez","zac apron","","on the verge of a nervous breakthrough",1802,1521,1,32323,19346,2013-02-02 09:09:21,FALSE,NA,"TheVerge"
"925","STRIPERSPECIAL","TACKLE BOX","1134 Hwy 36 Hazlet, N.J. 07730","The Sciortino family have been helping anglers catch fish since 1945! BAIT- TACKLE & BEACH Proud Military Family! 🇺🇸732-264-7711 #VERGE #XVG",714,1193,7,1031,4497,2011-03-20 11:27:14,FALSE,"http://Instagram.com/tackleboxnj","TheVerge"
"926","_alexarose","LiLBrklynBrat","Brooklyn, NY","on the verge of a quarter-life crisis at any given moment. | 📲 @mtv",660,265,6,24641,1549,2010-12-16 02:34:59,FALSE,"http://Instagram.com/_alexarose","TheVerge"
"927","HaileySharon13","Hailey Verge","Canada","RECE. Vegetarian. Easily confused. Mother of friend group.",112,39,11,2787,492,2009-10-05 01:51:59,FALSE,NA,"TheVerge"
"928","darkmarpme","marpme","127.0.0.1","Verge Developer - independence.",2824,456,17,1354,6377,2013-03-27 16:51:39,FALSE,"https://vergecurrency.com/","TheVerge"
"929","katefpetty","Kate Petty","🛁","Plant lover (and Road Verge Campaign Manager @Love_Plants); Culture vulture, Book worm, (Day)Dreamer, and sometimes a harpist and a singer...",500,1545,6,1095,2903,2014-09-10 15:42:55,FALSE,NA,"TheVerge"
"930","yacketycat","Amanda Wolfe","Houston, TX","Writer. Blogger. Lowbrow Highbrow. Confidante. Flirt. 
Perpetually on the verge of being a celebrity.",409,543,15,4025,548,2009-03-05 04:02:57,FALSE,NA,"TheVerge"
"931","ABraveHen","You can't reform what's irredeemable","","Streamer, speedrunner (Axiom Verge+Celeste), PhD in Comp Sci. Parent with too many hobbies. 日本語ＯＫ。she/her",265,435,10,17239,45599,2007-04-03 15:55:34,FALSE,"https://twitch.tv/SaberaMesia","TheVerge"
"932","multimediamay","May R 🦋🤎","Norfolk, VA","on the verge of taking over multimedia. | IG: MultimediaMay| ODU |",223,224,0,2273,2271,2018-09-16 20:59:42,FALSE,NA,"TheVerge"
"933","matiasims","Matías Muñoz","Santiago, Chile","Student. Reader of @verge and @9to5mac. Header by @poolga. ",275,402,2,5607,2569,2008-12-19 16:41:18,FALSE,NA,"TheVerge"
"934","VergeConsulting","Kelli King-Jackson","Houston, TX","Building capacity of nonprofit organizations through program design, proposal writing and partnership development. Based in Houston, serving globally!",500,568,44,2315,11,2009-12-02 07:42:30,FALSE,"http://www.vergeconsultinggroup.com","TheVerge"
"935","LindsayLeigh24","Lindsay Verge","","",95,94,1,1134,1160,2013-04-14 00:53:53,FALSE,NA,"TheVerge"
"936","Steph_Mayolee","Stephanie Mayolee","Ohio","Plant lady | Cleveland Arts Prize ""On The Verge"" Fellow | Fiction MFA Candidate, Brown University | Toni Morrison stan account",170,251,3,1614,484,2014-09-02 19:13:53,FALSE,"http://stephaniemayolee.com","TheVerge"
"937","KloberLtd","Klober Ltd","Global","Membranes | Pitched Roof Vents | Eaves Ventilation | Ridge & Hip | Dry Verge & Valleys | Lead Free Flashings | Roof Safety | Flat Roof Outlets",2572,1513,18,2122,845,2013-04-11 10:39:48,FALSE,"http://klober.co.uk","TheVerge"
"938","VergeIce","Verge-Ice","Immortal Harlem Allday","I left some swag on the corner so these clowns can pick some up... What Up!",358,0,5,27766,7,2009-05-17 17:28:22,FALSE,NA,"TheVerge"
"939","access2boysclub","Mark Verge","Santa Monica CA","Los Angeles Entrepreneur & Author",311,1092,15,162,1,2009-12-08 18:06:38,FALSE,"http://www.accesstotheboysclub.com/","TheVerge"
"940","elcincodemaya","maya houston ✨","ATL ✈️ LA","TV Writer: #Arrow. NBC Writers On The Verge Fellow. USC Alumni. Winner of “The New Normal” Writing Contest. | Rep: Zero Gravity Management & APA (she / her)",3339,700,36,17747,8153,2011-03-20 01:08:08,FALSE,"https://blacklivesmatter.carrd.co/","TheVerge"
"941","NerdsOnTheVerge","Nerds on the Verge","","Two nerds whose lives were destined to coincide venture forth to discover and discuss what lies in the depths of a nerd’s world. 📧thwip@nerdsontheverge.com",49,128,0,436,690,2019-06-17 22:41:58,FALSE,NA,"TheVerge"
"942","Beverle","Beverle Spruill","Memphis TN.","30 million Americans are on the verge of losing Obama Care: ""The Paper Trail"" official trailer   https://t.co/6GwPn1HDZ9",205,677,0,154,3,2010-05-23 01:01:25,FALSE,"http://www.cinqueproductions.com","TheVerge"
"943","LifeCoachMathew","Mathew Swinson","","On the VERGE of something BIG..Idk what it is, but Ima walk with God till I get there, and STAY wit Him THROUGH it..Only FOLLOW me as I FOLLOW God..lol",823,1936,7,14249,2615,2009-08-13 17:25:34,FALSE,NA,"TheVerge"
"944","Tweeterright","MelanieAmaroCanada","","Beautiful soul , on the verge to all. Voice that ummmmm. Outta ya! Awesome!!!",440,801,2,6751,305,2010-05-31 14:24:04,FALSE,NA,"TheVerge"
"945","Dan_Ventresca","Dan Ventresca","Boston, MA","A 17 handicap on the verge of going low",134,435,6,894,229,2009-09-03 16:27:43,FALSE,NA,"TheVerge"
"946","ganjadotcom","Ganja.com","Colorado, USA","https://t.co/Nav5Vf3DSZ is proud to partner with @vergecurrency! We now accept the $XVG #cryptocurrency on all #CBD orders. Get 20% OFF your order when you pay with #Verge.",1177,360,5,1380,12,2010-01-08 18:55:17,FALSE,"https://cbd.ganja.com","TheVerge"
"947","YourPrGuy","Kevin Mofokeng","Gaborone, Botswana","On the verge of greatness| Idealist | Digital PR Strategist @AYUCorg | For all your digital PR needs contact kevmofokeng@gmail.com |",2063,755,13,30574,5771,2014-07-11 18:13:41,FALSE,NA,"TheVerge"
"948","mmanal","Mark Manalaysay","San Francisco, CA","Documentation of a life well wasted | Design @apple | Opinions here are my own 👍 | Featured in @nytimes @nytmag @huffpost @verge @wired @howbrand",885,915,13,34597,14998,2008-04-18 14:09:21,FALSE,"http://mmanal.com","TheVerge"
"949","XcelPayWallet","XcelPay Wallet","Malta","Fully Decentralized & Unhackable P2P Crypto Wallet For All. #bitcoin #ethereum #binance #tron #bch #btc #bnb #trx #verge #dash Check out https://t.co/aQQf6CFxAk",792,614,1,824,701,2018-06-24 12:50:42,FALSE,"http://xcelpay.io","TheVerge"
"950","shawntaaa","Sean 🏳️‍🌈","Manhattan, NY","pronoun fluid. Senior Architect at Estée Lauder. on the verge of a nervous breakthrough 🦖",1346,699,2,19604,7308,2010-06-01 02:10:07,FALSE,"http://instagram.com/sean_and_gooby","TheVerge"
"951","flowersbymybed","Laura 🥀","Augsburg, Germany","Always on the verge of crying or having a panic attack, but my taste in music is fabulous. // Instagram: @flowersbymybed",1505,110,446,85959,681,2009-10-30 13:50:59,FALSE,"http://blitzundgewitter.tumblr.com/","TheVerge"
"952","ShoutFc","Shout verge fc","","",299,157,0,321,0,2011-07-31 14:10:01,FALSE,NA,"TheVerge"
"953","S3JR_","Stephen Spurlock Jr","Dallas, TX","𝐎𝐦𝐧𝐢𝐩𝐨𝐭𝐞𝐧𝐭 • 𝐎𝐧 𝐭𝐡𝐞 𝐕𝐞𝐫𝐠𝐞 •",1061,728,2,11081,13180,2011-05-10 05:12:58,FALSE,"http://Instagram.com/stephenspurlockjr","TheVerge"
"954","UKSammo","Sam Morgan🏴󠁧󠁢󠁥󠁮󠁧󠁿🇯🇲","London/Vegas","Manager: Epsom and Ewell FC ⚽️Sports Journalist for Verge Magazine and Presenter on The Sportsheads and AltSports⚽️🏈🏀 insta: @uksammo",723,1577,1,2544,1769,2009-04-22 18:46:56,FALSE,"http://www.vergemagazine.co.uk","TheVerge"
"955","Anthony_Madigan","EST. 1993","Hatfield, England","i'm the Rachel Green in my friendship group, possibly on the verge of an Amanda Bynes style breakdown, who knows? 🤴🏼💁🏼‍♂️",594,439,10,59556,23115,2009-04-26 20:30:38,FALSE,"https://www.facebook.com/anthonymadigan93","TheVerge"
"956","hwnglxy","lim !!","she/her","if its about seungmin then u have my full attention",2179,998,14,7768,4881,2020-05-03 07:57:49,FALSE,"http://skz.xn--8ci","TheVerge"
"957","hamzahaider","hamza haider","Lahore Pakistan","Lawyer. @chelseafc fan. constantly on the verge of an evolutionary breakthrough",414,428,2,3475,1665,2009-04-03 08:48:26,FALSE,NA,"TheVerge"
"958","Aeroon7","Aeroon","A Wonderful Place","Hiya! I do artsies for the Cookie Run community! I post whenever the 🦖 I feel like, and I'm on the verge of starting an urgent worldwide search for Dark Choco!",878,236,3,1948,18394,2018-04-28 03:20:55,FALSE,NA,"TheVerge"
"959","Social_Hippie","Adrian (Uh-Dree-In)","","NYC. Writer. Internal Hippie. On the verge of an awakening. Talk ish. Laugh. Love. Listen to music.",94,337,0,1610,1195,2012-05-09 12:57:15,FALSE,NA,"TheVerge"
"960","riyashrestha9","RIYA","NEPAL","In the verge of finding myself.....",1471,559,43,18725,22534,2011-07-11 03:53:26,FALSE,"https://differentthoughtsbyme.blogspot.com/","TheVerge"
"961","rawbertmack","Robert Mackenzie","Hamilton/Toronto/Dublin","journalism's bad boy | podcast stuff @TheHockeyNews | bylines @macleans @verge @motherboard @TheHockeyNews",262,580,3,777,1306,2014-11-29 05:29:40,FALSE,NA,"TheVerge"
"962","oothoon","Oothoon","Michigan, USA","The USA is on the verge of a nervous breakdown.",900,2441,10,76568,58734,2009-06-15 20:18:03,FALSE,NA,"TheVerge"
"963","TaNy_TheSweet","LeakLady TaNy","Indiana/USA","This little lady is on the verge of loving herself and becoming the woman she wants to be. Actress & Leak Lady with the Midwest Leak Mag #teamleak #leakladies",1096,1625,5,3939,14,2009-03-18 21:56:14,FALSE,"http://www.midwestleak.com","TheVerge"
"964","BanaChiquita","Dom😍","Trenton, NC","NCAT22❤️ Verge Modeling Troupe 💎 #LadiesOfTUS",1319,1694,1,1420,16891,2018-07-06 13:00:15,FALSE,NA,"TheVerge"
"965","verge_jr25","Alonzo Verge Jr","Chicago, IL","FreeRondoNumba9 FreeKodak1K",460,101,0,80,85,2016-06-20 03:48:43,FALSE,NA,"TheVerge"
"966","sroudman","Sam Roudman","LA","Writer/Producer. Recent: @factuallypod @drunkhistory @adamruins. Bylines: TNR, NYMag, BuzzFeed, The Verge,  @racketteen forever. Say hi! sroudman at gmail",552,1140,22,2062,2889,2010-01-02 20:08:10,FALSE,NA,"TheVerge"
"967","BiGDEAL_BL0VE","Kysh!","From the 404 🍑 to the 561 🌴 ","LIVIN'&L0VIN'LIFE=]
To Know Me Is To Love Me. If You Love Me Stop Hatin On Me.If You Hate Me You Don't Know Me:)
-ON THE VERGE OF SOMETHING EPIC! STAY TUNED!-",698,633,9,27488,27,2009-08-19 04:54:53,FALSE,NA,"TheVerge"
"968","ritatweetqueen","Rita Faria","Manchester","On the verge of both.",398,125,2,648,1608,2015-02-11 13:23:19,FALSE,NA,"TheVerge"
"969","gracechanwrites","Grace Chan | 陈淑仪","Upside Down","Writer, alien, nerd 🤓 Words in Clarkesworld, Going Down Swinging, Aurealis, AntiSF, Verge: Uncanny. Writes for @WarpGamesCo. She/her.",284,541,5,376,991,2018-06-27 07:27:24,FALSE,"http://www.gracechanwrites.com","TheVerge"
"970","JeniAnneJones","JENI JONES","Santa Monica, CA","🎬🎭Director NAACP award-winning “Women On the Verge” @clubratsmovie 🎧Rapper ⚔️Ninja S҉P҉A҉C҉E҉D҉R҉A҉G҉O҉N҉ 🚀#nasasocial🚀",296,831,15,3371,2670,2009-09-08 22:15:42,FALSE,"http://www.jenijones.com","TheVerge"
"971","drewclayton","drew clayton","Northern Kentucky","Husband to Candace. Dad to Lucy and Deacon. (Tweet featured in Huffington Post and The Verge)",406,312,12,8400,1184,2009-03-04 14:56:25,FALSE,NA,"TheVerge"
"972","vergefeels","Verge Feels","In your heart","",21,1,0,29,0,2015-02-06 21:06:32,FALSE,"http://theverge.com","TheVerge"
"973","impossibella_","maya hee maya hoo maya ha maya haha","leic//she/her ","on the verge of a nervous breakthru",513,1775,7,27015,92246,2014-08-20 09:27:22,FALSE,NA,"TheVerge"
"974","iMb3tt3rth4nyou","IG:Imb3tt3rthanyou","Chicago","A decade ago I never thought I would be At 23 On the verge of spontaneous combustion.",1350,1812,2,8312,2491,2010-12-13 19:40:14,FALSE,"http://imbetterthanyou91.tumblr.com/","TheVerge"
"975","vergeliever","Tonton Lowan XVG","Taiwan","PPC marketing analyst - VERGE Core marketing Team. In charge of the French market. 🇫🇷",1215,609,6,2651,1198,2017-12-27 16:19:07,FALSE,"http://VERGEcurrency.com","TheVerge"
"976","dbndude1","Digibyte Africa #10cDGBCharity","South Africa","Highly opiniated to the verge of becoming offensive. Proud Afrikaner. Putting my country before my Volk,in their time of need. Praying for this country I love.",1425,718,4,33302,28899,2017-09-29 11:25:05,FALSE,"http://digibyte.io","TheVerge"
"977","lebamore","Ⓐ Ⓡ Ⓑ Ⓨ","storage room, crying for help","a ma'am on the verge of a nervous breakᴛʜʀᴏᴜɢʜ",861,477,2,36702,63499,2009-04-08 05:24:04,FALSE,NA,"TheVerge"
"978","starchaser14","Pepper Reed","North Hollywood, Los Angeles","Fantasy TV Writer who uses the supernatural to tell personal narratives | Union Script Supervisor | NYU Tisch Alum | Finalist NBC Writers on the Verge 2019",243,266,6,1537,7030,2010-03-20 05:42:05,FALSE,"http://imdb.me/pepperreed","TheVerge"
"979","bensassoon","Ben Sassoon","London, England","Software Dev - creator of silly internet sites - featured on CNN, Fox, BBC, The Verge, Forbes, Jimmy Fallon Show. Previously: @howmuchtp. CS Grad.",201,208,1,99,1604,2011-06-20 19:01:45,FALSE,"http://www.bensassoon.com","TheVerge"
"980","theodosiarossi","theo rossi","Doha","✨ a woman on the verge of a nervous breakthrough ✨

Research Assistant @BrookingsDoha + Arabic MA Student @Middlebury

Previously @UniofOxford @UChicago",145,1060,0,255,503,2014-09-10 17:26:31,FALSE,NA,"TheVerge"
"981","AnneVerge","Anne Verge","Halifax, NS","Designer, book nerd, artist.",410,664,22,1201,41,2009-05-29 14:16:06,FALSE,"http://www.avcreative.ca","TheVerge"
"982","VergeNYC","TransD_Verge","New York, NY","VergeNYC is a design event bringing together creative thinkers, field experts, and change makers to @SDSParsons and @TheNewSchool in New York City.",152,311,11,279,82,2014-12-05 03:40:15,FALSE,"http://verge.nyc","TheVerge"
"983","vergemusiclab","Verge Music Lab","Toronto, ON","Vibey recording studio built in a historic downtown Toronto mansion.  Stellar array of vintage and modern gear.",451,722,10,222,127,2011-06-06 06:15:47,FALSE,"http://vergemusic.ca","TheVerge"
"984","ExchangerPoint","Exchanger Point","India","Trading plateform for #Bitcoin, #Ether, #Ripple ,#Litecoin, #Electroneum, #Dogecoin, #Steller, #Cardano , #EXPT and Verge etc",5738,450,9,4462,1139,2015-03-12 08:10:00,FALSE,"https://exchangerpoint.com","TheVerge"
"985","OnTheVergeBook","hirsch / ferguson","","",791,1463,15,1736,0,2011-03-17 00:17:15,FALSE,NA,"TheVerge"
"986","TheCryptoCamel","#XVG camel [Not giving a #sh3t]","Your Computer Right Now","Verge Currency [$XVG] Core Team | Video Production | Journalist at @CryptoSh3tNews More bull than you can bear.",1124,449,2,3283,4134,2018-01-15 00:01:48,FALSE,"https://www.Crypto-Suite.com","TheVerge"
"987","damienhasson","Damien Hasson","London, England","Actor/Writer. Derry. London. Clockwork Orange, Hollyoaks, Women on the Verge @SquawkVoices NI Screen New Writer Focus Award 2019/20",344,704,0,467,5574,2016-12-12 22:17:32,FALSE,"https://www.spotlight.com/interactive/cv/9495-1274-0953","TheVerge"
"988","jennaajlouny","Jenna","Los Angeles, CA","on the verge of tears",564,802,0,12148,32323,2011-08-26 20:57:23,FALSE,"https://blacklivesmatters.carrd.co/","TheVerge"
"989","btoceo","Brandies","Chicago, IL","A Black woman on the verge of something great. This is my journey navigating Food, Faith, Family & Finances. CEO and Co-founder of @sourcedigitalm",430,454,33,1026,313,2010-06-28 09:49:54,FALSE,"http://www.sourcedigitalmarketing.com/","TheVerge"
"990","vergemke","Verge","Milwaukee, WI","Milwaukee Alt-Rock Music Festival",607,1741,39,56,0,2010-01-05 21:03:22,FALSE,"http://www.vergemusicfestival.com/","TheVerge"
"991","bevwestwood","Bev","North Suffolk, UK","On the outskirts of nowhere, on the ring road to somewhere, on the verge of indecision I'll always take the roundabout way",365,357,7,72613,283,2010-06-13 18:18:24,FALSE,NA,"TheVerge"
"992","VergeSocialist","The Verge Socialist","","Exposing the bias of the editors of http://t.co/BnqPm6mQfK",105,10,2,10,0,2014-03-18 17:46:21,FALSE,NA,"TheVerge"
"993","MADEMOISELLEPR","MADEMOISELLE PR","Boston, MA","Media Agency which showcases emerging creatives on the verge of something amazing.",586,1322,38,56194,11189,2011-02-03 04:23:28,FALSE,NA,"TheVerge"
"994","edwardexcaliber","Edward G. Excaliber","Los Angeles, CA","NBC's Writers on the Verge 2018-19 
NHMC TV Writers Program 2017 
AFI c/o 2016 
Writer. Television Watcher. Book Reader. Frequent Pizza Eater.",175,290,6,111,442,2012-03-01 21:43:26,FALSE,NA,"TheVerge"
"995","technicallyrite","technicallyrite","Fort Worth, TX","Adventurer on the verge of discovery. UI, UX, CX, product, design, culture, motorsports, movies and travel. 🏍",293,996,23,1346,704,2008-12-19 15:32:04,FALSE,NA,"TheVerge"
"996","thevergefilm","The Verge","London, England","Twitter of the upcoming action, sci-fi short film The Verge. A Thunderhawk Pictures production, directed by Mark J. Blackman and written by Alba Moyano.",510,1076,23,282,274,2016-07-18 10:32:56,FALSE,"https://www.kickstarter.com/projects/1458866575/the-verge-short-film?ref=user_menu","TheVerge"
"997","Freecklez","the lost weasley","","✨ ✨The Diary of Tom Riddle: on the verge of being a wallflower ✨ ✨",295,315,2,20466,156,2009-08-05 02:33:35,FALSE,"https://vimeo.com/jacktheladmedia","TheVerge"
"998","SevenRedBlurs","Steven Mangold","","Writer of Comics and Stuff. I'm always on the verge of making sense.",286,2423,8,1896,3450,2009-03-09 16:41:59,FALSE,"http://www.bluerosestudios.net/","TheVerge"
"999","realdejour","Dejour Gardner","Spanish town, Jamaica","Jamaican Singer & Songwriter -WINNER of KFC On The Verge. follow my ig: @realdejour. check out my soundcloud: @realdejour. contact: dejourmusiq@gmail.com",252,120,5,1129,868,2013-06-19 19:29:07,FALSE,"http://www.dejourmusic.com","TheVerge"
"1000","VergeDC","Verge DC","Washington, D.C.","Building a D.C.-based startup? Verge is a startup event and platform for software startups. We publish startup advice, founder stories, and startup news.",118,1,31,6749,0,2013-07-29 23:21:00,FALSE,"http://vergestartups.com","TheVerge"
"1001","LNWNJ","LNWNJ","Late Night with Neil James","Im on the verge of becoming the most recognized person in the world!!! 😎",445,1177,4,5420,36,2009-04-10 09:45:59,FALSE,"http://projectlatenight.com","TheVerge"
"1002","JMW","James M. Woodward","Albuquerque, NM","The ramblings of an IT professional on the verge of absolutely nothing important.",268,157,53,17710,5650,2007-03-30 13:58:15,FALSE,NA,"TheVerge"
"1003","GlobalVergeCell","Global Verge","WorldWide","Xooma created FOCUS Up-the world's first Energy Think Drink. Designed from plant extracts and natural compounds, EDGE is the ultimate energy . $6.95.",906,1654,2,753,0,2009-06-30 23:47:43,FALSE,"http://xoomaleaders.com","TheVerge"
